{
  "$schema": "https://repo.mpm.nikomaru.dev/schema/plugin-info.json",
  "id": "MineAuth-addon-griefprevention",
  "source": "https://github.com/morinoparty/MineAuth",
  "repositories": [
    {
      "type": "github",
      "id": "morinoparty/MineAuth",
      "fileNameRegex": "MineAuth-addon-griefprevention-.*\\.jar$"
    }
  ],
  "dependencies": [
    "MineAuth"
  ],
  "softDependencies": [
    "GriefPrevention"
  ],
  "defaultVersion": "sync:MineAuth"
}
